{
  "tool_id": "r_scrutiny",
  "tool_name": "R scrutiny",
  "detector_runtime": "r",
  "dependency_status": "ready",
  "source": "/Users/daotuanwang/归档/项目/PreCheckResearch/mvp2/benchmark/reports/pcr.project_full.parts/data-1.parts/extracted/01_Sheet1.csv",
  "input_type": "summary_statistics_table",
  "findings": [
    {
      "level": "info",
      "check": "R scrutiny运行记录",
      "target": "摘要统计表",
      "summary": "R scrutiny 已运行。",
      "evidence": "GRIMMER候选行=1；DEBIT候选行=0",
      "detail": "",
      "suggestion": "若未发现高风险项，仍需结合变量类型和原始数据人工复核。",
      "meaning": "R scrutiny 已运行。",
      "normal_explanations": "可能的正常原因包括变量不是离散/整数评分、量表范围设定错误、四舍五入规则不同或表格抽取错误。",
      "review_steps": "若未发现高风险项，仍需结合变量类型和原始数据人工复核。",
      "confidence": "low",
      "confidence_score": 0.3,
      "false_positive_risk": "low",
      "tool_id": "r_scrutiny",
      "tool_name": "R scrutiny",
      "detector_runtime": "r",
      "dependency_status": "ready",
      "confidence_basis": "基于 R scrutiny 可行性检验、样本量/量表字段可解析性和依赖状态生成；需确认量表范围、四舍五入规则和变量类型。"
    }
  ]
}