{
  "tool_id": "r_statcheck",
  "tool_name": "R statcheck",
  "detector_runtime": "r",
  "dependency_status": "ready",
  "source": "/Users/daotuanwang/归档/项目/PreCheckResearch/mvp2/benchmark/inputs/apa_stats_suspicious.txt",
  "input_type": "apa_statistical_text",
  "findings": [{"level":"high","check":"R statcheck正文统计一致性","target":"t(28)=2.20, p=.90","summary":"R statcheck 发现正文统计量与报告 p 值不一致。","evidence":"报告p=0.9，反算p=0.0362254847788378","detail":"source=01; test_type=t; df1=NA; df2=28; test_comp==; test_value=2.2; p_comp==; reported_p=0.9; computed_p=0.0362254847788378; raw=t(28)=2.20, p=.90; error=TRUE; decision_error=TRUE; one_tailed_in_txt=FALSE; apa_factor=1","suggestion":"优先核对统计量、自由度、单双侧检验和 p 值是否来自同一次分析。","meaning":"R statcheck 发现正文统计量与报告 p 值不一致。","normal_explanations":"可能的正常原因包括四舍五入、单双侧检验、统计量抽取错误或同一结果不同版本未同步。","review_steps":"优先核对统计量、自由度、单双侧检验和 p 值是否来自同一次分析。","confidence":"high","false_positive_risk":"medium","tool_id":"r_statcheck","tool_name":"R statcheck","detector_runtime":"r","dependency_status":"ready"},{"level":"high","check":"R statcheck正文统计一致性","target":"F(1, 30)=5.00, p=.80","summary":"R statcheck 发现正文统计量与报告 p 值不一致。","evidence":"报告p=0.8，反算p=0.0329363059256379","detail":"source=01; test_type=F; df1=1; df2=30; test_comp==; test_value=5; p_comp==; reported_p=0.8; computed_p=0.0329363059256379; raw=F(1, 30)=5.00, p=.80; error=TRUE; decision_error=TRUE; one_tailed_in_txt=FALSE; apa_factor=1","suggestion":"优先核对统计量、自由度、单双侧检验和 p 值是否来自同一次分析。","meaning":"R statcheck 发现正文统计量与报告 p 值不一致。","normal_explanations":"可能的正常原因包括四舍五入、单双侧检验、统计量抽取错误或同一结果不同版本未同步。","review_steps":"优先核对统计量、自由度、单双侧检验和 p 值是否来自同一次分析。","confidence":"high","false_positive_risk":"medium","tool_id":"r_statcheck","tool_name":"R statcheck","detector_runtime":"r","dependency_status":"ready"}]
}

