{
  "tool_id": "r_rsprite2",
  "tool_name": "R rsprite2 SPRITE",
  "detector_runtime": "r",
  "dependency_status": "ready",
  "source": "/Users/daotuanwang/归档/项目/PreCheckResearch/mvp2/benchmark/inputs/summary_suspicious.csv",
  "input_type": "likert_or_integer_scale_summary",
  "findings": [
    {
      "level": "high",
      "check": "R rsprite2 SPRITE",
      "target": "行1",
      "summary": "SPRITE 未能找到匹配报告摘要统计的离散分布。",
      "evidence": "N=25, mean=10.0, SD=2.0, scale=1-5；Error in calculating range of possible standard deviations",
      "detail": "",
      "suggestion": "确认量表范围、均值/SD 小数精度、样本量和是否为离散评分摘要；高风险结果应由人工复核原始频数。",
      "meaning": "SPRITE 未能找到匹配报告摘要统计的离散分布。",
      "normal_explanations": "可能的正常原因包括量表范围、均值/SD 小数精度、约束条件或 rsprite2 搜索参数设置不匹配。",
      "review_steps": "确认量表范围、均值/SD 小数精度、样本量和是否为离散评分摘要；高风险结果应由人工复核原始频数。",
      "confidence": "medium",
      "confidence_score": 0.6,
      "false_positive_risk": "high",
      "tool_id": "r_rsprite2",
      "tool_name": "R rsprite2 SPRITE",
      "detector_runtime": "r",
      "dependency_status": "ready",
      "confidence_basis": "基于 R rsprite2 SPRITE 搜索结果、输入字段可解析性和依赖状态生成；需确认量表范围、精度和约束条件。"
    },
    {
      "level": "high",
      "check": "R rsprite2 SPRITE",
      "target": "行2",
      "summary": "SPRITE 未能找到匹配报告摘要统计的离散分布。",
      "evidence": "N=20, mean=5.0, SD=3.0, scale=1-5；Error in calculating range of possible standard deviations",
      "detail": "",
      "suggestion": "确认量表范围、均值/SD 小数精度、样本量和是否为离散评分摘要；高风险结果应由人工复核原始频数。",
      "meaning": "SPRITE 未能找到匹配报告摘要统计的离散分布。",
      "normal_explanations": "可能的正常原因包括量表范围、均值/SD 小数精度、约束条件或 rsprite2 搜索参数设置不匹配。",
      "review_steps": "确认量表范围、均值/SD 小数精度、样本量和是否为离散评分摘要；高风险结果应由人工复核原始频数。",
      "confidence": "medium",
      "confidence_score": 0.6,
      "false_positive_risk": "high",
      "tool_id": "r_rsprite2",
      "tool_name": "R rsprite2 SPRITE",
      "detector_runtime": "r",
      "dependency_status": "ready",
      "confidence_basis": "基于 R rsprite2 SPRITE 搜索结果、输入字段可解析性和依赖状态生成；需确认量表范围、精度和约束条件。"
    },
    {
      "level": "high",
      "check": "R rsprite2 SPRITE",
      "target": "行3",
      "summary": "SPRITE 未能找到匹配报告摘要统计的离散分布。",
      "evidence": "N=18, mean=8.0, SD=1.8, scale=1-5；Error in calculating range of possible standard deviations",
      "detail": "",
      "suggestion": "确认量表范围、均值/SD 小数精度、样本量和是否为离散评分摘要；高风险结果应由人工复核原始频数。",
      "meaning": "SPRITE 未能找到匹配报告摘要统计的离散分布。",
      "normal_explanations": "可能的正常原因包括量表范围、均值/SD 小数精度、约束条件或 rsprite2 搜索参数设置不匹配。",
      "review_steps": "确认量表范围、均值/SD 小数精度、样本量和是否为离散评分摘要；高风险结果应由人工复核原始频数。",
      "confidence": "medium",
      "confidence_score": 0.6,
      "false_positive_risk": "high",
      "tool_id": "r_rsprite2",
      "tool_name": "R rsprite2 SPRITE",
      "detector_runtime": "r",
      "dependency_status": "ready",
      "confidence_basis": "基于 R rsprite2 SPRITE 搜索结果、输入字段可解析性和依赖状态生成；需确认量表范围、精度和约束条件。"
    },
    {
      "level": "high",
      "check": "R rsprite2 SPRITE",
      "target": "行4",
      "summary": "SPRITE 未能找到匹配报告摘要统计的离散分布。",
      "evidence": "N=10, mean=12.0, SD=-1.0, scale=1-5；The standard deviation is not consistent with this mean and number of observations (fails GRIMMER test).\n         For details, see ?GRIMMER_test.",
      "detail": "",
      "suggestion": "确认量表范围、均值/SD 小数精度、样本量和是否为离散评分摘要；高风险结果应由人工复核原始频数。",
      "meaning": "SPRITE 未能找到匹配报告摘要统计的离散分布。",
      "normal_explanations": "可能的正常原因包括量表范围、均值/SD 小数精度、约束条件或 rsprite2 搜索参数设置不匹配。",
      "review_steps": "确认量表范围、均值/SD 小数精度、样本量和是否为离散评分摘要；高风险结果应由人工复核原始频数。",
      "confidence": "medium",
      "confidence_score": 0.6,
      "false_positive_risk": "high",
      "tool_id": "r_rsprite2",
      "tool_name": "R rsprite2 SPRITE",
      "detector_runtime": "r",
      "dependency_status": "ready",
      "confidence_basis": "基于 R rsprite2 SPRITE 搜索结果、输入字段可解析性和依赖状态生成；需确认量表范围、精度和约束条件。"
    },
    {
      "level": "info",
      "check": "R rsprite2运行记录",
      "target": "摘要统计表",
      "summary": "R rsprite2 SPRITE 已运行。",
      "evidence": "尝试行数=4",
      "detail": "",
      "suggestion": "SPRITE 是高级复核工具，解释时必须保留量表和搜索参数限制。",
      "meaning": "R rsprite2 SPRITE 已运行。",
      "normal_explanations": "可能的正常原因包括量表范围、均值/SD 小数精度、约束条件或 rsprite2 搜索参数设置不匹配。",
      "review_steps": "SPRITE 是高级复核工具，解释时必须保留量表和搜索参数限制。",
      "confidence": "low",
      "confidence_score": 0.3,
      "false_positive_risk": "medium",
      "tool_id": "r_rsprite2",
      "tool_name": "R rsprite2 SPRITE",
      "detector_runtime": "r",
      "dependency_status": "ready",
      "confidence_basis": "基于 R rsprite2 SPRITE 搜索结果、输入字段可解析性和依赖状态生成；需确认量表范围、精度和约束条件。"
    }
  ]
}