{
  "tool_id": "papermill_light_signals",
  "tool_name": "papermill_light_signals",
  "detector_runtime": "cli",
  "dependency_status": "not_applicable",
  "source": "/Users/daotuanwang/归档/项目/PreCheckResearch/mvp2/benchmark/inputs/paper_refs_and_claims.md",
  "input_type": "unknown",
  "findings": [
    {
      "table": "/Users/daotuanwang/归档/项目/PreCheckResearch/mvp2/benchmark/inputs/paper_refs_and_claims.md",
      "level": "info",
      "check": "工具运行记录",
      "target": "papermill_light_signals",
      "summary": "论文工厂轻量信号 未运行：not_applicable",
      "evidence": "当前数据类型不属于该工具包的适用范围。",
      "detail": "",
      "suggestion": "安装或修复该 CLI 后重试；其他可用工具的结果不受影响。",
      "tool_id": "papermill_light_signals",
      "tool_name": "papermill_light_signals",
      "module": "routing",
      "input_type": "unknown",
      "routing_reason": "由确定性路由选择该工具。",
      "method_limitations": "该结果只提示需要复核的风险信号，不构成数据风险校验判定。",
      "raw_output_ref": "",
      "detector_runtime": "cli",
      "dependency_status": "not_applicable",
      "meaning": "论文工厂轻量信号 未运行：not_applicable",
      "normal_explanations": "工具缺失、依赖缺失或路由跳过不是数据风险。",
      "review_steps": "检查 PATH、Rscript、对应 R 包安装状态和 route JSON。",
      "confidence": "low",
      "confidence_score": 0.1,
      "false_positive_risk": "low",
      "evidence_id": "papermill_light_signals:info:/Users/daotuanwang/归档/项目/PreCheckResearch/mvp2/benchmark/inputs/paper_refs_and_claims.md",
      "location": "/Users/daotuanwang/归档/项目/PreCheckResearch/mvp2/benchmark/inputs/paper_refs_and_claims.md",
      "calculation_trace": "",
      "external_records": "",
      "review_actions": "检查 PATH、Rscript、对应 R 包安装状态和 route JSON。",
      "confidence_basis": "该项来自工具路由或依赖检查，不是数据风险信号。"
    }
  ]
}